{
  "schema": "qlkg-document-ingest-receipt-v1",
  "request_id": "synthetic-upsert-1",
  "overall_status": "ready",
  "document": {"document_id": "doc:synthetic-note", "operation": "update"},
  "stages": {
    "authority_graph": {"status": "committed", "receipt_sha256": "aaaaaaaaaaaaaaaaaaaaaaaaaaaaaaaaaaaaaaaaaaaaaaaaaaaaaaaaaaaaaaaa"},
    "embeddings": {"status": "complete", "ready": 2, "missing": 0},
    "portable": {"status": "verified", "store_generation_sha256": "bbbbbbbbbbbbbbbbbbbbbbbbbbbbbbbbbbbbbbbbbbbbbbbbbbbbbbbbbbbbbbbb"},
    "materialization": {"status": "current", "database": "knowledge/build/knowledge.sqlite"}
  },
  "git_ready": true,
  "warnings": [],
  "receipt_sha256": "f3c8be44a6164cf12a1d8a069f82e1a7567f54c6c5370dbdcf6ea928c3a31883"
}
